{
  "format": "open-values-challenge-index",
  "version": "0.1.0",
  "standard": "open-values-standard",
  "built": "2026-08-14",
  "purpose": "Generated compact index for calm anti-echo-chamber surfaces across Open Values instances.",
  "generatedFrom": {
    "path": "content/challenge/index.json",
    "updated": "2026-08-14",
    "sha256": "9ca83042dccebb92743d145609b5969cc0e3598c8065c3a1295cab438ba05515"
  },
  "counts": {
    "instances": 3,
    "algorithms": 2,
    "cases": 7,
    "contraryTags": 16,
    "categories": 7
  },
  "principles": [
    "challenge is calm and dismissible",
    "opposite-view rankings are values-relative, not truth claims",
    "steelman facts must use existing sourced criteria evidence",
    "data generation alone must not decide app presentation"
  ],
  "algorithms": [
    {
      "id": "opposite-view",
      "label": "Opposite view",
      "summary": "Rank the same category under an explicit opposite weighting and show the strongest honest case for that result."
    },
    {
      "id": "steelman",
      "label": "Steelman",
      "summary": "For the user's likely top pick, surface the lowest-scoring sourced weakness on an axis the view weights at 2 or below."
    }
  ],
  "instances": [
    {
      "id": "conscious-consuming",
      "label": "Conscious Consuming",
      "role": "reference-consumption-instance",
      "challengeDefault": "available",
      "surfaces": [
        "verdict",
        "category",
        "entry"
      ]
    },
    {
      "id": "kosplora",
      "label": "Kosplora",
      "role": "flagship-learning-instance",
      "challengeDefault": "prominent",
      "surfaces": [
        "learning-result",
        "resource-detail",
        "pathway"
      ],
      "config": {
        "preferAxes": [
          "openness",
          "depth",
          "accessibility",
          "calm"
        ],
        "challengePrompt": "See a credible learning path that pushes against this preference.",
        "mustNot": [
          "Do not gamify challenge exposure.",
          "Do not rank controversy above evidence quality."
        ]
      }
    },
    {
      "id": "socrates-colosseum",
      "label": "Socrates Colosseum",
      "role": "future-structured-dissent-instance",
      "status": "format-seed",
      "challengeDefault": "primary",
      "surfaces": [
        "position",
        "claim",
        "source-set"
      ],
      "config": {
        "preferAxes": [
          "source-quality",
          "opposing-view",
          "claim-limits"
        ],
        "challengePrompt": "Read the strongest sourced version of the other position.",
        "mustNot": [
          "Do not publish unsourced claims.",
          "Do not count attention as agreement."
        ]
      }
    }
  ],
  "categories": [
    {
      "id": "ai-assistants",
      "label": "AI assistants",
      "type": "Services",
      "file": "app/data/ai-assistants.json",
      "n": 98,
      "criteria": [
        {
          "key": "privacy",
          "label": "Privacy"
        },
        {
          "key": "transparency",
          "label": "Transparent"
        },
        {
          "key": "openness",
          "label": "Open weights"
        },
        {
          "key": "safety",
          "label": "Safety"
        },
        {
          "key": "accessibility",
          "label": "Easy & free"
        },
        {
          "key": "wellbeing",
          "label": "Good for you"
        }
      ]
    },
    {
      "id": "banking",
      "label": "Banking",
      "type": "Services",
      "file": "app/data/banking.json",
      "n": 25,
      "criteria": [
        {
          "key": "environment",
          "label": "Fossil-fuel financing"
        },
        {
          "key": "ethics",
          "label": "Ethics & ownership"
        },
        {
          "key": "transparency",
          "label": "Transparent"
        },
        {
          "key": "fees",
          "label": "Low fees"
        },
        {
          "key": "accessibility",
          "label": "Easy to use"
        },
        {
          "key": "complaints",
          "label": "Complaint record"
        }
      ]
    },
    {
      "id": "digital-services",
      "label": "Digital services",
      "type": "Services",
      "file": "app/data/digital-services.json",
      "n": 522,
      "criteria": [
        {
          "key": "privacy",
          "label": "Privacy"
        },
        {
          "key": "openness",
          "label": "Open"
        },
        {
          "key": "portability",
          "label": "Portable"
        },
        {
          "key": "respect",
          "label": "No surveillance"
        },
        {
          "key": "accessibility",
          "label": "Accessible"
        },
        {
          "key": "economical",
          "label": "Economical"
        }
      ]
    },
    {
      "id": "learning-resources",
      "label": "Learning resources",
      "type": "Media",
      "file": "app/data/learning-resources.json",
      "n": 703,
      "criteria": [
        {
          "key": "educational",
          "label": "Learning value"
        },
        {
          "key": "openness",
          "label": "Free & open"
        },
        {
          "key": "depth",
          "label": "Depth"
        },
        {
          "key": "accessibility",
          "label": "Accessible"
        },
        {
          "key": "calm",
          "label": "Calm"
        },
        {
          "key": "economical",
          "label": "Economical"
        }
      ]
    },
    {
      "id": "news-sources",
      "label": "News sources",
      "type": "Media",
      "file": "app/data/news-sources.json",
      "n": 123,
      "criteria": [
        {
          "key": "independence",
          "label": "Independent ownership"
        },
        {
          "key": "transparency",
          "label": "Transparent"
        },
        {
          "key": "nonprofit",
          "label": "Nonprofit / public"
        },
        {
          "key": "depth",
          "label": "Original depth"
        },
        {
          "key": "accessibility",
          "label": "Free to read"
        }
      ]
    },
    {
      "id": "password-managers",
      "label": "Password managers",
      "type": "Services",
      "file": "app/data/password-managers.json",
      "n": 88,
      "criteria": [
        {
          "key": "privacy",
          "label": "Privacy"
        },
        {
          "key": "transparency",
          "label": "Transparent"
        },
        {
          "key": "openness",
          "label": "Open source"
        },
        {
          "key": "security",
          "label": "Security track record"
        },
        {
          "key": "accessibility",
          "label": "Easy & free"
        }
      ]
    },
    {
      "id": "vpn",
      "label": "VPNs",
      "type": "Services",
      "file": "app/data/vpn.json",
      "n": 77,
      "criteria": [
        {
          "key": "privacy",
          "label": "No-logs privacy"
        },
        {
          "key": "transparency",
          "label": "Audited & transparent"
        },
        {
          "key": "openness",
          "label": "Open source"
        },
        {
          "key": "jurisdiction",
          "label": "Privacy jurisdiction"
        },
        {
          "key": "accessibility",
          "label": "Easy & affordable"
        }
      ]
    }
  ],
  "cases": [
    {
      "id": "ai-assistants-open-local-vs-managed-safety",
      "category": "ai-assistants",
      "label": "Open/local AI assistant versus managed safety",
      "reads": "The strongest case the other way: ChatGPT gives broad access and a managed safety program.",
      "userView": {
        "label": "Privacy and openness first",
        "weights": {
          "privacy": 5,
          "transparency": 5,
          "openness": 5,
          "safety": 2,
          "accessibility": 1
        },
        "expectedTop": "jan-ai",
        "top": {
          "code": "jan-ai",
          "name": "Jan",
          "brand": "local open-source assistant",
          "score": 84,
          "coverage": 1,
          "why": [
            "Privacy",
            "Open weights"
          ]
        }
      },
      "oppositeView": {
        "label": "Managed safety and broad access first",
        "weights": {
          "privacy": 1,
          "transparency": 1,
          "openness": 1,
          "safety": 5,
          "accessibility": 5
        },
        "expectedTop": "chatgpt",
        "top": {
          "code": "chatgpt",
          "name": "ChatGPT (OpenAI)",
          "brand": "frontier lab",
          "score": 81,
          "coverage": 1,
          "why": [
            "Easy & free",
            "Safety"
          ]
        },
        "sourceTag": "ai-assistants/chatgpt/accessibility",
        "selectedTag": {
          "tag": "ai-assistants/chatgpt/accessibility",
          "axis": "accessibility",
          "score": 94,
          "summary": "ChatGPT makes its default Luna model available on the free tier, while paid plans add Terra and the flagship Sol tier.",
          "source": {
            "note": "OpenAI's GPT-5.6 Luna tier is the default model for Free and Go users, with Terra and the flagship Sol tier available on paid plans; free-tier usage remains limited and dynamic.",
            "source": "https://help.openai.com/en/articles/11909943",
            "asof": "2026-08"
          }
        },
        "receipt": {
          "tag": "ai-assistants/chatgpt/accessibility",
          "axis": "accessibility",
          "score": 94,
          "summary": "ChatGPT makes its default Luna model available on the free tier, while paid plans add Terra and the flagship Sol tier.",
          "source": {
            "note": "OpenAI's GPT-5.6 Luna tier is the default model for Free and Go users, with Terra and the flagship Sol tier available on paid plans; free-tier usage remains limited and dynamic.",